[
  {"id":"claim:geometry.slices.section","kind":"formal","statement":"단면은 입체와 평면의 교집합이다. 속이 찬 구를 중심에서 반지름보다 가까운 평면으로 자르면 원판이 된다.","scope":"유클리드 공간의 이상적인 속이 찬 구; 두께 없는 평면. 구의 표면만의 교집합인 원과 구 내부를 포함한 원판을 구별한다.","assumptions":["R>0","중심을 원점으로 잡고 절단 평면은 z=h"],"sourceRefs":[{"sourceId":"source:openstax-calculus2-slicing","locator":"§2.2, Volume and the Slicing Method, opening definition of cross-section before Figure 2.11"},{"sourceId":"source:openstax-calculus3-sphere","locator":"§2.2, Rule: Equation of a Sphere, Eq. (2.2); substitute center (0,0,0), z=h and include the interior inequality"}],"reviewStatus":"draft-source-aligned"},
  {"id":"claim:geometry.slices.radius","kind":"formal","statement":"|h|≤R에서 단면 반지름은 r=√(R²−h²)이고 넓이는 π(R²−h²)이다. 고정된 R에서 |h|가 커지면 r은 줄어든다.","scope":"교재의 구 방정식에 z=h를 대입한 직접 유도; 길이는 cm, 넓이는 cm². 구현 범위 1≤R≤5, −6≤h≤6.","assumptions":["속이 찬 유클리드 구","|h|≤R"],"sourceRefs":[{"sourceId":"source:openstax-calculus3-sphere","locator":"§2.2 Eq. (2.2), x²+y²+z²=R² at origin: z=h gives x²+y²=R²−h²; rearrange as r²+h²=R²"},{"sourceId":"source:openstax-calculus2-slicing","locator":"§2.2 Example 2.7, step 2: circle area A=πr²; apply to the derived section radius"}],"reviewStatus":"draft-source-aligned"},
  {"id":"claim:geometry.slices.symmetry","kind":"formal","statement":"고정된 구에서 h와 −h의 단면 반지름과 넓이는 같다.","scope":"r²=R²−h²의 직접적인 대수적 귀결; 위치는 다를 수 있다.","assumptions":["같은 R","|h|≤R"],"sourceRefs":[{"sourceId":"source:openstax-calculus3-sphere","locator":"§2.2 Eq. (2.2), centered sphere; direct substitution z=h and z=−h gives identical x²+y²"}],"reviewStatus":"draft-source-aligned"},
  {"id":"claim:geometry.slices.boundary","kind":"formal","statement":"|h|=R에서 구와 평면의 교집합은 한 점이며, |h|>R에서는 공집합이다.","scope":"중심이 원점인 구와 z=h 평면; 한 점과 공집합은 다르지만 단면 넓이는 모두 0이다.","assumptions":["R>0","실수 좌표"],"sourceRefs":[{"sourceId":"source:openstax-calculus3-sphere","locator":"§2.2 Eq. (2.2), direct consequence: x²+y²≤R²−h²; RHS zero permits only origin in plane, RHS negative permits no real points"}],"reviewStatus":"draft-source-aligned"}
]
