[
  {
    "id": "claim:statistics.two-children.family-model",
    "kind": "draft-teaching-model",
    "statement": "독립이고 아들/딸 확률이 각각 1/2인 두 자녀라는 단순 모형에서 출생순 BB,BG,GB,GG는 각각 1/4. 실제 인구 통계의 주장이 아니다.",
    "scope": "동일한 문장도 선별·관측 절차에 따라 다른 조건부확률이 될 수 있음을 설명한다.",
    "assumptions": [
      "Children are modeled as independent B/G outcomes, each with probability 1/2",
      "Family identities retain birth order; this is not a demographic model"
    ],
    "sourceRefs": [
      {
        "sourceId": "source:iyer-conditional-probability-2026",
        "locator": "Definition 2; Propositions 5–6. Finite cases below are independently derived teaching models."
      }
    ],
    "reviewStatus": "needs-content-review"
  },
  {
    "id": "claim:statistics.two-children.family-filter",
    "kind": "draft-teaching-model",
    "statement": "가족을 균등 추출해 적어도 한 명이 아들인지 묻고 예라고 한 가족만 남기면 두 아들일 확률은 1/3.",
    "scope": "동일한 문장도 선별·관측 절차에 따라 다른 조건부확률이 될 수 있음을 설명한다.",
    "assumptions": [
      "Four birth-order families have equal prior probability 1/4",
      "Every uniformly selected family answers the same at-least-one-boy question truthfully and without nonresponse",
      "Condition on the affirmative answer, not an identified child's sex"
    ],
    "sourceRefs": [
      {
        "sourceId": "source:iyer-conditional-probability-2026",
        "locator": "Definition 2; Propositions 5–6. Finite cases below are independently derived teaching models."
      }
    ],
    "reviewStatus": "needs-content-review"
  },
  {
    "id": "claim:statistics.two-children.family-child",
    "kind": "draft-teaching-model",
    "statement": "가족을 균등 추출한 뒤 자녀 한 명을 균등 선택해 아들임을 관측하면 두 아들일 확률은 1/2. BB의 관측 우도는 1, BG/GB는 각각 1/2.",
    "scope": "동일한 문장도 선별·관측 절차에 따라 다른 조건부확률이 될 수 있음을 설명한다.",
    "assumptions": [
      "Four birth-order families have equal prior probability 1/4",
      "Select a family uniformly, then select its child index independently and uniformly",
      "Condition on observing a boy without specifying the selected birth-order index"
    ],
    "sourceRefs": [
      {
        "sourceId": "source:iyer-conditional-probability-2026",
        "locator": "Definition 2; Propositions 5–6. Finite cases below are independently derived teaching models."
      }
    ],
    "reviewStatus": "needs-content-review"
  },
  {
    "id": "claim:statistics.two-children.reporting-rule",
    "kind": "draft-teaching-model",
    "statement": "네 출생순 가족의 사전확률이 각각 1/4일 때, 아들이 있음을 보장하는 하나의 고정된 증거 사건 E에 대해 P(E|BB)=a, P(E|BG)=b, P(E|GB)=c, P(E|GG)=0이면 a+b+c>0에서 P(BB|E)=a/(a+b+c)이다. 절차가 바뀌면 E와 우도를 새로 정의한다. 별도의 사건 E₁을 모든 가족이 ‘첫째가 아들인가요?’에 진실하게 예라고 답하는 것으로 정하면 우도는 1,1,0,0이어서 BB와 BG만 남고 P(BB|E₁)=1/2이다.",
    "scope": "Declared toy model and independently derived reporting procedures; not demographic data or a claim that voluntary speech follows a known policy.",
    "assumptions": ["Four birth-order families each have prior probability 1/4", "The same reporting event is used for all family cases", "0≤a,b,c≤1 and a+b+c>0", "Truthful reporting excludes GG; arbitrary voluntary reporting probabilities remain unknown"],
    "sourceRefs": [{"sourceId": "source:iyer-conditional-probability-2026", "locator": "Definition 2 and Propositions 5–6 for conditioning and the total observation probability; Definition 12 for independence. Family-report formula and firstborn case are independently authored finite deductions, not source examples."}],
    "reviewStatus": "needs-content-review"
  }
]
