[
  {
    "id": "claim:number-systems.rational.definition",
    "kind": "definition",
    "statement": "유리수는 a,b가 정수이고 b≠0일 때 a/b 꼴로 나타낼 수 있는 수이다. 모든 정수 n은 n/1로 나타낼 수 있다.",
    "scope": "유리수의 초등적 정의. 정수쌍 동치류의 집합론적 구현 세부는 생략한다.",
    "assumptions": ["분모는 0이 아니다", "분수 표기는 정수의 비를 나타낸다"],
    "sourceRefs": [{"sourceId":"source:openstax-contemporary-rationals","locator":"§3.4 Defining and Identifying Numbers That Are Rational: integer numerator and nonzero integer denominator; n=n/1"}],
    "reviewStatus": "draft-source-aligned"
  },
  {
    "id": "claim:number-systems.rational.equivalence",
    "kind": "formal",
    "statement": "b,d가 0이 아닐 때 a/b와 c/d는 ad=bc인 경우에 그리고 그 경우에만 같은 유리수를 나타낸다.",
    "scope": "정수 분자·분모로 된 유리수 표기의 동치 판정.",
    "assumptions": ["b≠0", "d≠0", "정수의 곱셈과 등식을 사용한다"],
    "sourceRefs": [{"sourceId":"source:openstax-contemporary-rationals","locator":"§3.4 Simplifying Rational Numbers and Expressing in Lowest Terms: equivalent fractions and cross-product test"}],
    "reviewStatus": "draft-source-aligned"
  },
  {
    "id": "claim:number-systems.rational.zero-denominator",
    "kind": "formal",
    "statement": "유리수 표현 a/b에서는 b=0을 허용하지 않으며, 0으로 나누기는 유리수 연산으로 정의되지 않는다.",
    "scope": "유리수의 표준 산술. 극한, 확장실수, 리만 구면 등의 별도 문맥은 포함하지 않는다.",
    "assumptions": ["0×x=0", "나눗셈은 허용되는 0이 아닌 수의 곱셈 역원을 사용한다"],
    "sourceRefs": [
      {"sourceId":"source:openstax-college-algebra-2e-real-numbers","locator":"§1.1 Classifying a Real Number and Inverse Properties: denominator never zero; multiplicative inverse only for nonzero values"},
      {"sourceId":"source:mactutor-zero-history","locator":"Historical discussion of incompatible failed rules for division by zero; used only to distinguish history from the modern exclusion"}
    ],
    "reviewStatus": "draft-source-aligned"
  },
  {
    "id": "claim:number-systems.rational.density",
    "kind": "formal",
    "statement": "서로 다른 두 유리수 x<y 사이에는 유리수 (x+y)/2가 있으며 x<(x+y)/2<y이다.",
    "scope": "유리수의 순서 조밀성. 모든 실수가 유리수라거나 유리수가 완비하다는 주장은 포함하지 않는다.",
    "assumptions": ["x와 y는 유리수", "x<y", "유리수의 덧셈과 0이 아닌 2로 나눗셈을 사용한다"],
    "sourceRefs": [{"sourceId":"source:openstax-contemporary-rationals","locator":"§3.4 Applying the Density Property of Rational Numbers: add the two rationals and divide by 2"}],
    "reviewStatus": "draft-source-aligned"
  },
  {
    "id": "claim:number-systems.rational.not-complete",
    "kind": "formal",
    "statement": "유리수의 순서 조밀성은 최소상한 성질을 보장하지 않으며, 유리수 체계는 최소상한 의미에서 완비하지 않다.",
    "scope": "후속 무리수·실수 완비성 편을 위한 개념 경계만 기록한다. √2의 비유리성과 Q의 비완비성 증명, 최소상한의 세부 정의는 이 글에서 전개하지 않는다.",
    "assumptions": ["조밀성과 최소상한 성질은 서로 다른 명제다", "비완비성의 증명은 이 글의 중간값 논증에서 따라오지 않는다"],
    "sourceRefs": [{"sourceId":"source:ucdavis-analysis-real-numbers","locator":"§1.1 Completeness of R, Definition 1.3, Theorem 1.7, Example 1.8 and Example 1.11"}],
    "reviewStatus": "draft-source-aligned"
  }
]
