[
  {"id":"claim:computing.binary-search.elimination","kind":"formal","statement":"오름차순 배열에서 가운데 원소와 목표를 비교해 같으면 종료하고, 목표가 작으면 가운데와 그 오른쪽, 크면 가운데와 그 왼쪽을 제외할 수 있다.","scope":"순서 비교가 일관된 정렬 배열. 화면은 서로 다른 양의 짝수 2,4,…,2n을 사용한다.","assumptions":["배열은 탐색 전에 오름차순으로 정렬되어 있다","화면에서 원소 접근과 한 원소와의 비교를 한 탐색 단계로 센다"],"sourceRefs":[{"sourceId":"source:nist-binary-search","locator":"Definition: sorted array; middle-key comparison; repeatedly halve the search interval"}],"reviewStatus":"draft-source-aligned"},
  {"id":"claim:computing.binary-search.bound","kind":"formal","statement":"비어 있지 않은 n개 배열에서 가운데 인덱스를 내림하여 선택하고 확인한 원소를 제외하는 이진 탐색의 최악 탐색 단계 수는 floor(log2 n)+1이다. 따라서 n=16,32,1000이면 각각 5,6,10회이다.","scope":"각 단계는 한 배열 원소와 목표의 크기·같음 비교를 하나로 센다. 정렬 비용, 개별 기계 명령, 벽시계 시간은 제외한다. 이 모델의 구체적 상한은 불일치 후 남은 원소 수가 floor(n/2) 이하라는 점에서 계산한 수학적 귀결이다.","assumptions":["정렬된 배열에 임의 위치 접근 가능","n은 1 이상 정수","가운데 원소를 비교한 후 재검사하지 않는다"],"sourceRefs":[{"sourceId":"source:nist-binary-search","locator":"Definition (repeated interval halving), Note (O(ln n)); exact finite bound is the stated model's derived consequence, not a quotation of the source"}],"reviewStatus":"draft-source-aligned"},
  {"id":"claim:computing.binary-search.absence","kind":"formal","statement":"정렬된 배열에 대한 이진 탐색에서 목표를 보존하는 후보 구간이 비면 목표 원소가 없다고 결론내린다.","scope":"목표가 있다면 후보 구간 안에 있다는 조건을 유지하는 이진 탐색. 임의의 제한된 탐색 실패 일반을 부재와 동일시하지 않는다.","assumptions":["배열은 오름차순 정렬되어 있다","후보 제외 규칙이 올바르게 적용된다"],"sourceRefs":[{"sourceId":"source:nist-binary-search","locator":"Definition, final sentence: terminate when the value is found or the interval is empty"}],"reviewStatus":"draft-source-aligned"}
]
